Book Name,Price,Rating,Link
You Are Not Stupid: Computers and Technology Simplified,$0.00,4.5 out of 5 stars,https://www.amazon.com/gp/slredirect/picassoRedirect.html/ref=pa_sp_atf_aps_sr_pg1_1?ie=UTF8&adId=A02223852UIKSM9Y1LAJ8&url=%2FYou-Are-Not-Stupid-Technology-ebook%2Fdp%2FB08B3VJLGZ%2Fref%3Dsr_1_1_sspa%3Fkeywords%3Dcomputer%2Bbooks%26qid%3D1639629572%26sr%3D8-1-spons%26psc%3D1&qualifier=1639629572&id=5926852096705536&widgetName=sp_atf
"Java: The Complete Reference, Twelfth Edition",$44.80,5.0 out of 5 stars,https://www.amazon.com/Java-Complete-Reference-Herbert-Schildt/dp/1260463419/ref=sr_1_2?keywords=computer+books&qid=1639629572&sr=8-2
Computers For Seniors For Dummies (For Dummies (Computer/Tech)),$14.59,4.2 out of 5 stars,https://www.amazon.com/Computers-Seniors-Dummies-Computer-Tech/dp/1119420318/ref=sr_1_3?keywords=computer+books&qid=1639629572&sr=8-3
The Self-Taught Programmer: The Definitive Guide to Programming Professionally,$21.87,4.6 out of 5 stars,https://www.amazon.com/Self-Taught-Programmer-Definitive-Programming-Professionally/dp/0999685902/ref=sr_1_4?keywords=computer+books&qid=1639629572&sr=8-4
Essential Computer Hardware Second Edition: The Illustrated Guide to Understanding Computer Hardware (Computer Essentials),$13.49,4.3 out of 5 stars,https://www.amazon.com/Essential-Computer-Hardware-Second-Understanding/dp/1911174924/ref=sr_1_5?keywords=computer+books&qid=1639629572&sr=8-5
Everything You Need to Ace Computer Science and Coding in One Big Fat Notebook: The Complete Middle School Study Guide (Big Fat Notebooks),$12.87,4.8 out of 5 stars,https://www.amazon.com/Everything-Computer-Science-Coding-Notebook/dp/1523502770/ref=sr_1_6?keywords=computer+books&qid=1639629572&sr=8-6
"Princeton Review AP Computer Science Principles Prep, 2022: 3 Practice Tests + Complete Content Review + Strategies & Techniques (2022) (College Test Preparation)",$14.10,4.5 out of 5 stars,https://www.amazon.com/Princeton-Review-Computer-Science-Principles/dp/0525570837/ref=sr_1_7?keywords=computer+books&qid=1639629572&sr=8-7
Troubleshooting & Maintaining PCs All-in-One For Dummies (For Dummies (Computer/Tech)),$25.80,4.4 out of 5 stars,https://www.amazon.com/Troubleshooting-Maintaining-All-One-Dummies/dp/1119740304/ref=sr_1_8?keywords=computer+books&qid=1639629572&sr=8-8
"Computers for Seniors: Email, Internet, Photos, and More in 14 Easy Lessons",$18.30,4.2 out of 5 stars,https://www.amazon.com/Computers-Seniors-Internet-Photos-Lessons/dp/159327792X/ref=sr_1_9?keywords=computer+books&qid=1639629572&sr=8-9
You Are Not Stupid: Computers and Technology Simplified,$15.99,4.5 out of 5 stars,https://www.amazon.com/You-Are-Not-Stupid-Technology/dp/0997326492/ref=sr_1_10?keywords=computer+books&qid=1639629572&sr=8-10
"The Computer Book: From the Abacus to Artificial Intelligence, 250 Milestones in the History of Computer Science (Sterling Milestones)",$29.95,4.6 out of 5 stars,https://www.amazon.com/Computer-Book-Artificial-Intelligence-Milestones/dp/145492621X/ref=sr_1_11?keywords=computer+books&qid=1639629572&sr=8-11
,,,
PCs For Dummies,$16.49,4.3 out of 5 stars,https://www.amazon.com/PCs-Dummies-Dan-Gookin/dp/1119041775/ref=sr_1_13?keywords=computer+books&qid=1639629572&sr=8-13
"CompTIA A+ Certification All-in-One Exam Guide, Tenth Edition (Exams 220-1001 & 220-1002)",$35.13,4.7 out of 5 stars,https://www.amazon.com/CompTIA-Certification-Guide-220-1001-220-1002/dp/1260454037/ref=sr_1_14?keywords=computer+books&qid=1639629572&sr=8-14
Upgrading and Repairing PCs,$17.70,4.7 out of 5 stars,https://www.amazon.com/Upgrading-Repairing-22nd-Scott-Mueller/dp/0789756102/ref=sr_1_15?keywords=computer+books&qid=1639629572&sr=8-15
Windows 10 For Dummies (For Dummies (Computer/Tech)),$18.69,4.4 out of 5 stars,https://www.amazon.com/Windows-10-Dummies-Computer-Tech/dp/1119679338/ref=sr_1_16?keywords=computer+books&qid=1639629572&sr=8-16
Coding for Kids: Python: Learn to Code with 50 Awesome Games and Activities,$12.73,4.6 out of 5 stars,https://www.amazon.com/Coding-Kids-Python-Awesome-Activities/dp/1641521759/ref=sr_1_17?keywords=computer+books&qid=1639629572&sr=8-17
Excel Formulas & Functions For Dummies (For Dummies (Computers)),$19.99,4.5 out of 5 stars,https://www.amazon.com/Excel-Formulas-Functions-Dummies-Bluttman/dp/1119518253/ref=sr_1_18?keywords=computer+books&qid=1639629572&sr=8-18
Building Your Own Computer Made Easy: The Step By Step Guide (Computers Made Easy),$13.99,4.5 out of 5 stars,https://www.amazon.com/Building-Your-Computer-Made-Easy/dp/1791955568/ref=sr_1_19?keywords=computer+books&qid=1639629572&sr=8-19
BUILD YOUR OWN GAMING COMPUTER: A Step-by-Step Illustrated Guide to Assembling Your Ultimate High-Performance PC,$12.99,4.4 out of 5 stars,https://www.amazon.com/BUILD-GAMING-COMPUTER-Step-Step/dp/B08Z5FV1ST/ref=sr_1_20?keywords=computer+books&qid=1639629572&sr=8-20
Windows 10 For Seniors For Dummies (For Dummies (Computer/Tech)),$19.65,4.2 out of 5 stars,https://www.amazon.com/Windows-Seniors-Dummies-Computer-Tech/dp/1119680549/ref=sr_1_21?keywords=computer+books&qid=1639629572&sr=8-21
"Computer Programming Crash Course: 7 Books in 1- Coding Languages for Beginners: C++, C#, SQL, Python, Data Science for Python, Raspberry pi and Arduino. Teach Yourself to Code. Learn Faster.",$33.33,4.4 out of 5 stars,https://www.amazon.com/Computer-Programming-Crash-Course-Languages/dp/B086PMZXM7/ref=sr_1_22?keywords=computer+books&qid=1639629572&sr=8-22
LEARN PYTHON AND KERAS PROGRAMMING: CRASH COURSE FOR BEGINNERS: A GUIDE TO CODING QUICKLY,$0.00,,https://www.amazon.com/LEARN-PYTHON-KERAS-PROGRAMMING-BEGINNERS-ebook/dp/B09NDTDLFD/ref=sr_1_23?keywords=computer+books&qid=1639629572&sr=8-23
Build Your Own Gaming PC: The step-by-step manual to building the ultimate computer (Haynes Manuals),$19.49,4.5 out of 5 stars,https://www.amazon.com/Build-Your-Gaming-step-step/dp/1785216686/ref=sr_1_24?keywords=computer+books&qid=1639629572&sr=8-24
Computer Networking: This Book Includes: Computer Networking for Beginners and Beginners Guide (All in One),$0.00,4.6 out of 5 stars,https://www.amazon.com/Computer-Networking-This-Beginners-Guide-ebook/dp/B08381Z1H1/ref=sr_1_25?keywords=computer+books&qid=1639629572&sr=8-25
"Senior Guide to iPhone: The Most Complete and Intuitive Step-by-Step Manual to Master your New iPhone, with Tips and Tricks for Senior Beginner Users (Updated & Illustrated Instructions)",$17.95,4.9 out of 5 stars,https://www.amazon.com/gp/slredirect/picassoRedirect.html/ref=pa_sp_mtf_aps_sr_pg1_1?ie=UTF8&adId=A1035995MO0EM2U57BXH&url=%2FSenior-Guide-iPhone-Step-Step%2Fdp%2FB09MYRCSNC%2Fref%3Dsr_1_26_sspa%3Fkeywords%3Dcomputer%2Bbooks%26qid%3D1639629572%26sr%3D8-26-spons%26psc%3D1&qualifier=1639629572&id=5926852096705536&widgetName=sp_mtf
Excel: Pivot Tables & Charts (Quick Study Computer),$5.95,4.6 out of 5 stars,https://www.amazon.com/gp/slredirect/picassoRedirect.html/ref=pa_sp_mtf_aps_sr_pg1_1?ie=UTF8&adId=A10251402Y6TUC0R48E1K&url=%2FExcel-Pivot-Tables-Charts-Computer%2Fdp%2F1423216431%2Fref%3Dsr_1_27_sspa%3Fkeywords%3Dcomputer%2Bbooks%26qid%3D1639629572%26sr%3D8-27-spons%26psc%3D1&qualifier=1639629572&id=5926852096705536&widgetName=sp_mtf
How To Start A Podcast: Launch A Podcast For Free With No Previous Experience,$9.99,4.3 out of 5 stars,https://www.amazon.com/gp/slredirect/picassoRedirect.html/ref=pa_sp_mtf_aps_sr_pg1_1?ie=UTF8&adId=A00319232WDG5VMOOAUAO&url=%2FHow-Start-Podcast-Previous-Experience%2Fdp%2F1916475132%2Fref%3Dsr_1_28_sspa%3Fkeywords%3Dcomputer%2Bbooks%26qid%3D1639629572%26sr%3D8-28-spons%26psc%3D1&qualifier=1639629572&id=5926852096705536&widgetName=sp_mtf
"HTML and CSS QuickStart Guide: The Simplified Beginners Guide to Developing a Strong Coding Foundation, Building Responsive Websites, and Mastering ... of Modern Web Design (QuickStart Guides)",$21.99,4.6 out of 5 stars,https://www.amazon.com/HTML-CSS-QuickStart-Guide-Simplified/dp/1636100007/ref=sr_1_29?keywords=computer+books&qid=1639629572&sr=8-29
Office 365 All-in-One For Dummies,$18.79,4.4 out of 5 stars,https://www.amazon.com/Office-All-One-Dummies-Computer/dp/1119576245/ref=sr_1_30?keywords=computer+books&qid=1639629572&sr=8-30
,,,
"Computer Basics Absolute Beginner's Guide, Windows 10 Edition",$24.99,4.2 out of 5 stars,https://www.amazon.com/Computer-Basics-Absolute-Beginners-Windows/dp/0136498817/ref=sr_1_32?keywords=computer+books&qid=1639629572&sr=8-32
Tim Cook: The Genius Who Took Apple to the Next Level,$0.00,4.2 out of 5 stars,https://www.amazon.com/Tim-Cook-Leander-Kahney-audiobook/dp/B07M8YJSG9/ref=sr_1_33?keywords=computer+books&qid=1639629572&sr=8-33
Computer Programming for Beginners: Fundamentals of Programming Terms and Concepts,$0.00,4.3 out of 5 stars,https://www.amazon.com/Computer-Programming-Beginners-Fundamentals-Concepts-ebook/dp/B07D6D5W99/ref=sr_1_34?keywords=computer+books&qid=1639629572&sr=8-34
"Learn JavaScript Quickly: A Complete Beginner’s Guide to Learning JavaScript, Even If You’re New to Programming (Crash Course With Hands-On Project)",$15.99,4.6 out of 5 stars,https://www.amazon.com/Learn-JavaScript-Quickly-Programming-Hands/dp/1951791479/ref=sr_1_35?keywords=computer+books&qid=1639629572&sr=8-35
Computer Architecture: A Quantitative Approach (The Morgan Kaufmann Series in Computer Architecture and Design),$15.99,4.6 out of 5 stars,https://www.amazon.com/Computer-Architecture-Quantitative-Approach-Kaufmann/dp/0128119055/ref=sr_1_36?keywords=computer+books&qid=1639629572&sr=8-36
Home Computers: 100 Icons that Defined a Digital Generation (The MIT Press),$20.99,4.6 out of 5 stars,https://www.amazon.com/Home-Computers-Defined-Digital-Generation/dp/0262044013/ref=sr_1_37?keywords=computer+books&qid=1639629572&sr=8-37
Computer Programming for Absolute Beginners: Learn essential computer science concepts and coding techniques to kick-start your programming career,$34.99,4.4 out of 5 stars,https://www.amazon.com/Computer-Programming-Absolute-Beginners-programming/dp/1839216867/ref=sr_1_38?keywords=computer+books&qid=1639629572&sr=8-38
"Electronics for Beginners: A Practical Introduction to Schematics, Circuits, and Microcontrollers",$31.99,4.8 out of 5 stars,https://www.amazon.com/Electronics-Beginners-Introduction-Schematics-Microcontrollers/dp/1484259785/ref=sr_1_39?keywords=computer+books&qid=1639629572&sr=8-39
Macs For Seniors For Dummies,$19.89,4.2 out of 5 stars,https://www.amazon.com/Macs-Seniors-Dummies-Computer-Tech/dp/1119607825/ref=sr_1_40?keywords=computer+books&qid=1639629572&sr=8-40
"How Computers Work: The Evolution of Technology, 10th Edition",$30.91,4.5 out of 5 stars,https://www.amazon.com/How-Computers-Work-Evolution-Technology/dp/078974984X/ref=sr_1_41?keywords=computer+books&qid=1639629572&sr=8-41
"ITIL Foundation, ITIL (ITIL 4 Foundation)",$28.01,4.6 out of 5 stars,https://www.amazon.com/ITIL-foundation-Axelos/dp/0113316070/ref=sr_1_42?keywords=computer+books&qid=1639629572&sr=8-42
Portraits with an iPhone: Photo Techniques for Pro Quality Images (Phone Photography for Everybody Series),$20.99,5.0 out of 5 stars,https://www.amazon.com/Portraits-iPhone-Techniques-Photography-Everybody/dp/1682034534/ref=sr_1_43?keywords=computer+books&qid=1639629572&sr=8-43
Freaking Idiots Guides 2 Book Bundle: How to Sell on eBay and Fiverr,$17.99,5.0 out of 5 stars,https://www.amazon.com/Freaking-Idiots-Guides-Book-Bundle/dp/1483910180/ref=sr_1_44?keywords=computer+books&qid=1639629572&sr=8-44
Ideas That Created the Future: Classic Papers of Computer Science,$39.06,4.7 out of 5 stars,https://www.amazon.com/Ideas-That-Created-Future-Computer/dp/0262045303/ref=sr_1_45?keywords=computer+books&qid=1639629572&sr=8-45
The Berenstain Bears' Computer Trouble,$3.99,4.8 out of 5 stars,https://www.amazon.com/Berenstain-Bears-Computer-Trouble/dp/0060573945/ref=sr_1_46?keywords=computer+books&qid=1639629572&sr=8-46
Cybersecurity For Dummies,$12.99,4.5 out of 5 stars,https://www.amazon.com/Cybersecurity-Dummies-Joseph-Steinberg/dp/1119560322/ref=sr_1_47?keywords=computer+books&qid=1639629572&sr=8-47
"Learning Deep Learning: Theory and Practice of Neural Networks, Computer Vision, Natural Language Processing, and Transformers Using TensorFlow",$50.54,5.0 out of 5 stars,https://www.amazon.com/Learning-Deep-Processing-Transformers-TensorFlow/dp/0137470355/ref=sr_1_48?keywords=computer+books&qid=1639629572&sr=8-48
Build Your Own PC Do-It-Yourself For Dummies,$29.25,4.2 out of 5 stars,https://www.amazon.com/Build-Your-Own-Yourself-Dummies/dp/0470196114/ref=sr_1_49?keywords=computer+books&qid=1639629572&sr=8-49
Android Phones for Seniors in easy steps: Updated for Android v7 Nougat,$15.99,4.1 out of 5 stars,https://www.amazon.com/Android-Phones-Seniors-easy-steps/dp/1840788747/ref=sr_1_50?keywords=computer+books&qid=1639629572&sr=8-50
Algorithms: Practical Guide to Learn Algorithms For Beginners,$0.00,5.0 out of 5 stars,https://www.amazon.com/Algorithms-Practical-Guide-Learn-Beginners-ebook/dp/B09NDQ2BXJ/ref=sr_1_51?keywords=computer+books&qid=1639629572&sr=8-51
Machine Learning for Beginners: Learn the Basics of Artificial Intelligence. A Step-by-Step Overview to the Fundamentals of Machine Learning and Data Science (2022 Guide),$0.00,5.0 out of 5 stars,https://www.amazon.com/Machine-Learning-Beginners-Step-Step-ebook/dp/B09N7PBL62/ref=sr_1_52?keywords=computer+books&qid=1639629572&sr=8-52
A Programmer's Guide to Computer Science: A virtual degree for the self-taught developer,$26.99,4.4 out of 5 stars,https://www.amazon.com/gp/slredirect/picassoRedirect.html/ref=pa_sp_btf_aps_sr_pg1_1?ie=UTF8&adId=A00139861NM8PDC3LT3FQ&url=%2FProgrammers-Guide-Computer-Science-self-taught%2Fdp%2F195120400X%2Fref%3Dsr_1_53_sspa%3Fkeywords%3Dcomputer%2Bbooks%26qid%3D1639629572%26sr%3D8-53-spons%26psc%3D1&qualifier=1639629572&id=5926852096705536&widgetName=sp_btf
"Scratch Coding For Kids: The Beginner’s Guide to Easily Code Stories, Games, and Animations with Fun Activities",$10.97,5.0 out of 5 stars,https://www.amazon.com/gp/slredirect/picassoRedirect.html/ref=pa_sp_btf_aps_sr_pg1_1?ie=UTF8&adId=A0819818IZREN70TTLBU&url=%2FScratch-Coding-Kids-Animations-Activities%2Fdp%2FB09M567G9M%2Fref%3Dsr_1_54_sspa%3Fkeywords%3Dcomputer%2Bbooks%26qid%3D1639629572%26sr%3D8-54-spons%26psc%3D1&qualifier=1639629572&id=5926852096705536&widgetName=sp_btf
The Read Aloud Cloud: An Innocent's Guide to the Tech Inside,$14.68,4.8 out of 5 stars,https://www.amazon.com/gp/slredirect/picassoRedirect.html/ref=pa_sp_btf_aps_sr_pg1_1?ie=UTF8&adId=A07635702WL2VHQW9FQ5S&url=%2FRead-Aloud-Cloud-Innocents-Inside%2Fdp%2F1119677629%2Fref%3Dsr_1_55_sspa%3Fkeywords%3Dcomputer%2Bbooks%26qid%3D1639629572%26sr%3D8-55-spons%26psc%3D1&qualifier=1639629572&id=5926852096705536&widgetName=sp_btf
Profit from Your Podcast: Proven Strategies to Turn Listeners into a Livelihood,$14.99,4.7 out of 5 stars,https://www.amazon.com/gp/slredirect/picassoRedirect.html/ref=pa_sp_btf_aps_sr_pg1_1?ie=UTF8&adId=A052959837A42CTH0B78O&url=%2FProfit-Your-Podcast-Strategies-Livelihood%2Fdp%2F1621537722%2Fref%3Dsr_1_56_sspa%3Fkeywords%3Dcomputer%2Bbooks%26qid%3D1639629572%26sr%3D8-56-spons%26psc%3D1&qualifier=1639629572&id=5926852096705536&widgetName=sp_btf
Podcasting Made Simple: The Step by Step Guide on How to Start a Successful Podcast from the Ground up,$16.99,4.6 out of 5 stars,https://www.amazon.com/gp/slredirect/picassoRedirect.html/ref=pa_sp_btf_aps_sr_pg1_1?ie=UTF8&adId=A0866396147HIRFXXVVRK&url=%2FPodcasting-Made-Simple-Successful-Podcast%2Fdp%2FB08KBCVVND%2Fref%3Dsr_1_57_sspa%3Fkeywords%3Dcomputer%2Bbooks%26qid%3D1639629572%26sr%3D8-57-spons%26psc%3D1&qualifier=1639629572&id=5926852096705536&widgetName=sp_btf
Manipulation: 3 Books in 1: Defend Yourself from Emotional Blackmail and Learn Techniques of Subliminal Psychology and Dark Seduction to Influence Your Enemies Thoughts or Behaviors,$21.99,4.8 out of 5 stars,https://www.amazon.com/gp/slredirect/picassoRedirect.html/ref=pa_sp_btf_aps_sr_pg1_1?ie=UTF8&adId=A026831939LKU9GFFZO6U&url=%2FManipulation-Emotional-Techniques-Subliminal-Psychology%2Fdp%2FB098CM2JSS%2Fref%3Dsr_1_58_sspa%3Fkeywords%3Dcomputer%2Bbooks%26qid%3D1639629572%26sr%3D8-58-spons%26psc%3D1&qualifier=1639629572&id=5926852096705536&widgetName=sp_btf
Doing Good Better: How to be an Effective Board Member of a Nonprofit Organization,$11.99,4.8 out of 5 stars,https://www.amazon.com/gp/slredirect/picassoRedirect.html/ref=pa_sp_atf_next_aps_sr_pg2_1?ie=UTF8&adId=A07921893U3PWGOLD7E0&url=%2FDoing-Good-Better-Effective-Organization%2Fdp%2F1561488240%2Fref%3Dsr_1_49_sspa%3Fkeywords%3Dcomputer%2Bbooks%26qid%3D1639629575%26sr%3D8-49-spons%26psc%3D1&qualifier=1639629575&id=5416986935049869&widgetName=sp_atf_next
Follow Me To: A Journey around the World Through the Eyes of Two Ordinary Travelers,$19.89,4.5 out of 5 stars,https://www.amazon.com/gp/slredirect/picassoRedirect.html/ref=pa_sp_atf_next_aps_sr_pg2_1?ie=UTF8&adId=A0831773FBDBB50TMTUB&url=%2FFollow-Me-Journey-Ordinary-Travelers%2Fdp%2F1629145505%2Fref%3Dsr_1_50_sspa%3Fkeywords%3Dcomputer%2Bbooks%26qid%3D1639629575%26sr%3D8-50-spons%26psc%3D1&qualifier=1639629575&id=5416986935049869&widgetName=sp_atf_next
"Learn C++ Quickly: A Complete Beginner’s Guide to Learning C++, Even If You’re New to Programming (Crash Course With Hands-On Project)",$17.22,4.4 out of 5 stars,https://www.amazon.com/gp/slredirect/picassoRedirect.html/ref=pa_sp_atf_next_aps_sr_pg2_1?ie=UTF8&adId=A0576945UQNAWLANYX5D&url=%2FLearn-Quickly-Beginners-Programming-Hands%2Fdp%2F1951791622%2Fref%3Dsr_1_51_sspa%3Fkeywords%3Dcomputer%2Bbooks%26qid%3D1639629575%26sr%3D8-51-spons%26psc%3D1&qualifier=1639629575&id=5416986935049869&widgetName=sp_atf_next
CompTIA A+ Complete Deluxe Study Guide: Exam Core 1 220-1001 and Exam Core 2 220-1002,$42.89,4.6 out of 5 stars,https://www.amazon.com/gp/slredirect/picassoRedirect.html/ref=pa_sp_atf_next_aps_sr_pg2_1?ie=UTF8&adId=A03370651D7KX8JPV42IT&url=%2FCompTIA-Complete-Deluxe-Study-Guide%2Fdp%2F1119515963%2Fref%3Dsr_1_52_sspa%3Fkeywords%3Dcomputer%2Bbooks%26qid%3D1639629575%26sr%3D8-52-spons%26psc%3D1&qualifier=1639629575&id=5416986935049869&widgetName=sp_atf_next
Zoom For Dummies (For Dummies (Computer/Tech)),$15.95,4.3 out of 5 stars,https://www.amazon.com/Zoom-Dummies-Computer-Tech/dp/1119742145/ref=sr_1_53?keywords=computer+books&qid=1639629575&sr=8-53
The Self-Taught Computer Scientist: The Beginner's Guide to Data Structures & Algorithms,$24.29,4.6 out of 5 stars,https://www.amazon.com/Self-Taught-Computer-Scientist-Beginners-Science/dp/1119724414/ref=sr_1_54?keywords=computer+books&qid=1639629575&sr=8-54
Practical Machine Learning for Computer Vision: End-to-End Machine Learning for Images,$52.10,4.2 out of 5 stars,https://www.amazon.com/Practical-Machine-Learning-Computer-Vision/dp/1098102363/ref=sr_1_55?keywords=computer+books&qid=1639629575&sr=8-55
The Memory Librarian: And Other Stories of Dirty Computer,$26.09,,https://www.amazon.com/Memory-Librarian-Other-Stories-Computer/dp/0063070871/ref=sr_1_56?keywords=computer+books&qid=1639629575&sr=8-56
Learn Coding Basics in Hours with JavaScript,$3.99,4.6 out of 5 stars,https://www.amazon.com/Learn-Coding-Basics-Hours-JavaScript/dp/0997326468/ref=sr_1_57?keywords=computer+books&qid=1639629575&sr=8-57
"Coding for Absolute Beginners and Cybersecurity: 5 BOOKS IN 1 THE PROGRAMMING BIBLE: Learn Well the Fundamental Functions of Python, Java, C++ and How to Protect Your Data from Hacker Attacks",$24.88,4.8 out of 5 stars,https://www.amazon.com/Coding-Absolute-Beginners-Cybersecurity-PROGRAMMING/dp/B096TJP576/ref=sr_1_58?keywords=computer+books&qid=1639629575&sr=8-58
"Hacking: 4 Books in 1- Hacking for Beginners, Hacker Basic Security, Networking Hacking, Kali Linux for Hackers",$0.00,4.6 out of 5 stars,https://www.amazon.com/Hacking-Beginners-Security-Networking-Hackers-ebook/dp/B081MXSKR2/ref=sr_1_59?keywords=computer+books&qid=1639629575&sr=8-59
"Get Coding!: Learn HTML, CSS & JavaScript & Build a Website, App & Game",$11.59,4.6 out of 5 stars,https://www.amazon.com/Get-Coding-Learn-JavaScript-Website/dp/076369276X/ref=sr_1_60?keywords=computer+books&qid=1639629575&sr=8-60
A New History of Modern Computing (History of Computing),$40.00,5.0 out of 5 stars,https://www.amazon.com/New-History-Modern-Computing/dp/0262542900/ref=sr_1_61?keywords=computer+books&qid=1639629575&sr=8-61
HTML: Structure of A Web Page,$0.00,,https://www.amazon.com/HTML-Structure-Page-Shubham-K-ebook/dp/B09NCGNV3D/ref=sr_1_62?keywords=computer+books&qid=1639629575&sr=8-62
"Learn Coding Basics for Kids, Young Adults and People Who Are Young at Heart, With Python: Python Computer Programming Made Easy!",$6.89,4.6 out of 5 stars,https://www.amazon.com/Coding-Basics-Adults-People-Python/dp/B08GLP3YDM/ref=sr_1_63?keywords=computer+books&qid=1639629575&sr=8-63
"Modern Computer Architecture and Organization: Learn x86, ARM, and RISC-V architectures and the design of smartphones, PCs, and cloud servers",$34.99,4.8 out of 5 stars,https://www.amazon.com/Modern-Computer-Architecture-Organization-architectures/dp/1838984399/ref=sr_1_64?keywords=computer+books&qid=1639629575&sr=8-64
"The Complete Software Tester: Concepts, Skills, and Strategies for High-Quality Testing",$0.00,5.0 out of 5 stars,https://www.amazon.com/Complete-Software-Tester-Strategies-High-Quality-ebook/dp/B09NGVVCJ9/ref=sr_1_65?keywords=computer+books&qid=1639629575&sr=8-65
Carlo Acutis: God's Computer Genius,$21.95,,https://www.amazon.com/Carlo-Acutis-Gods-Computer-Genius/dp/0819817007/ref=sr_1_66?keywords=computer+books&qid=1639629575&sr=8-66
,,,
Code: The Hidden Language of Computer Hardware and Software,$20.89,4.6 out of 5 stars,https://www.amazon.com/Code-Language-Computer-Hardware-Software/dp/0735611319/ref=sr_1_68?keywords=computer+books&qid=1639629575&sr=8-68
The Game Console 2.0: A Photographic History from Atari to Xbox,$28.71,4.8 out of 5 stars,https://www.amazon.com/Game-Console-2-0-Photographic-History/dp/1718500602/ref=sr_1_69?keywords=computer+books&qid=1639629575&sr=8-69
Computer Science Distilled: Learn the Art of Solving Computational Problems,$19.75,4.5 out of 5 stars,https://www.amazon.com/Computer-Science-Distilled-Computational-Problems/dp/0997316020/ref=sr_1_70?keywords=computer+books&qid=1639629575&sr=8-70
Backdoor: Bypassing the Gatekeepers in Cybersecurity,$0.00,5.0 out of 5 stars,https://www.amazon.com/Backdoor-Gatekeepers-Cybersecurity-Femi-Reis-ebook/dp/B09N91X7FC/ref=sr_1_71?keywords=computer+books&qid=1639629575&sr=8-71
Humble Pi: When Math Goes Wrong in the Real World,$15.30,4.6 out of 5 stars,https://www.amazon.com/Humble-Pi-When-Wrong-World/dp/0593084691/ref=sr_1_72?keywords=computer+books&qid=1639629575&sr=8-72
Windows 11 For Dummies,$21.46,4.6 out of 5 stars,https://www.amazon.com/Windows-11-Dummies-Andy-Rathbone/dp/1119846471/ref=sr_1_73?keywords=computer+books&qid=1639629575&sr=8-73
iPad For Seniors For Dummies (For Dummies (Computer/Tech)),$29.99,,https://www.amazon.com/iPad-Seniors-Dummies-Computer-Tech/dp/1119863236/ref=sr_1_74?keywords=computer+books&qid=1639629575&sr=8-74
Teach Yourself VISUALLY Chromebook (Teach Yourself VISUALLY (Tech)),$20.80,4.3 out of 5 stars,https://www.amazon.com/Teach-Yourself-VISUALLY-Chromebook-Tech/dp/1119762960/ref=sr_1_75?keywords=computer+books&qid=1639629575&sr=8-75
CompTIA A+ Certification All-in-One For Dummies,$29.99,4.6 out of 5 stars,https://www.amazon.com/CompTIA-Certification-All-One-Dummies/dp/1119581060/ref=sr_1_76?keywords=computer+books&qid=1639629575&sr=8-76
Remotely Rich: How to multiply your income as a web developer,$0.00,4.5 out of 5 stars,https://www.amazon.com/gp/slredirect/picassoRedirect.html/ref=pa_sp_mtf_aps_sr_pg2_1?ie=UTF8&adId=A05607353RZG6D9IZX4IT&url=%2FRemotely-Rich-multiply-income-developer-ebook%2Fdp%2FB01I9HUYI8%2Fref%3Dsr_1_77_sspa%3Fkeywords%3Dcomputer%2Bbooks%26qid%3D1639629575%26sr%3D8-77-spons%26psc%3D1&qualifier=1639629575&id=5416986935049869&widgetName=sp_mtf
What Would You Do If You Weren't Afraid?: Discover a Life Filled with Purpose and Joy Through the Secrets of Jewish Wisdom,$16.23,4.7 out of 5 stars,https://www.amazon.com/gp/slredirect/picassoRedirect.html/ref=pa_sp_mtf_aps_sr_pg2_1?ie=UTF8&adId=A03806661R7IIKVYRR1BR&url=%2FWhat-Would-You-Werent-Afraid%2Fdp%2F0744029104%2Fref%3Dsr_1_78_sspa%3Fkeywords%3Dcomputer%2Bbooks%26qid%3D1639629575%26sr%3D8-78-spons%26psc%3D1&qualifier=1639629575&id=5416986935049869&widgetName=sp_mtf
"Excel 2021: A Step-By-Step Approach to Learning the Fundamentals of Excel Grasping Advanced Features like Business Modelling, Sampling Design and Numerous Data Analysis Techniques",$18.95,4.6 out of 5 stars,https://www.amazon.com/gp/slredirect/picassoRedirect.html/ref=pa_sp_mtf_aps_sr_pg2_1?ie=UTF8&adId=A08264991GC42PH0AFPVZ&url=%2FExcel-2021-Step-Step-Fundamentals%2Fdp%2FB094TCWMKT%2Fref%3Dsr_1_79_sspa%3Fkeywords%3Dcomputer%2Bbooks%26qid%3D1639629575%26sr%3D8-79-spons%26psc%3D1&qualifier=1639629575&id=5416986935049869&widgetName=sp_mtf
Classic Computer Science Problems in Python,$29.53,4.3 out of 5 stars,https://www.amazon.com/Classic-Computer-Science-Problems-Python/dp/1617295981/ref=sr_1_80?keywords=computer+books&qid=1639629575&sr=8-80
Excel Formulas and Functions 2020: The Step by Step Excel Guide with Examples on How to Create Powerful Formulas (Excel Academy Book 1),$0.00,4.3 out of 5 stars,https://www.amazon.com/Excel-Formulas-Functions-2020-Examples-ebook/dp/B088P7QQRZ/ref=sr_1_81?keywords=computer+books&qid=1639629575&sr=8-81
"Mac for Seniors: The illustrated, Step-by-step guide on how to use your Mac (Senior Guides)",$15.99,,https://www.amazon.com/Mac-Seniors-illustrated-Step-step/dp/B09M547QB8/ref=sr_1_82?keywords=computer+books&qid=1639629575&sr=8-82
A Programmer's Guide to Computer Science: A virtual degree for the self-taught developer,$26.99,4.4 out of 5 stars,https://www.amazon.com/Programmers-Guide-Computer-Science-self-taught/dp/195120400X/ref=sr_1_83?keywords=computer+books&qid=1639629575&sr=8-83
