Book Name,Price,Rating,Link
The Big Book of Serial Killers (An Encyclopedia of Serial Killers),$19.95,4.7 out of 5 stars,https://www.amazon.com/gp/slredirect/picassoRedirect.html/ref=pa_sp_atf_aps_sr_pg1_1?ie=UTF8&adId=A0899484177V7HTYQOHJ9&url=%2FBig-Book-Serial-Killers%2Fdp%2F1548119644%2Fref%3Dsr_1_1_sspa%3Fkeywords%3Dcrime%2Bbooks%26qid%3D1639629589%26sr%3D8-1-spons%26psc%3D1&qualifier=1639629589&id=3849533315152952&widgetName=sp_atf
"Jeffrey Dahmer: A Terrifying True Story of Rape, Murder & Cannibalism (The Serial Killer Books)",$11.95,4.3 out of 5 stars,https://www.amazon.com/gp/slredirect/picassoRedirect.html/ref=pa_sp_atf_aps_sr_pg1_1?ie=UTF8&adId=A0609200NADJWUCT3MPU&url=%2FJeffrey-Dahmer-Terrifying-Murder-Cannibalism%2Fdp%2F1545130434%2Fref%3Dsr_1_2_sspa%3Fkeywords%3Dcrime%2Bbooks%26qid%3D1639629589%26sr%3D8-2-spons%26psc%3D1&qualifier=1639629589&id=3849533315152952&widgetName=sp_atf
The Big Book of Serial Killers Volume 2: Another 150 Serial Killer Files of the World's Worst Murderers (An Encyclopedia of Serial Killers),$13.98,4.7 out of 5 stars,https://www.amazon.com/gp/slredirect/picassoRedirect.html/ref=pa_sp_atf_aps_sr_pg1_1?ie=UTF8&adId=A05419261YA407SQJ3YQD&url=%2FBig-Book-Serial-Killers-Encyclopedia%2Fdp%2F171030779X%2Fref%3Dsr_1_3_sspa%3Fkeywords%3Dcrime%2Bbooks%26qid%3D1639629589%26sr%3D8-3-spons%26psc%3D1&qualifier=1639629589&id=3849533315152952&widgetName=sp_atf
Murder at Venegoni's (VENEGONIS Book 1),$0.00,4.2 out of 5 stars,https://www.amazon.com/gp/slredirect/picassoRedirect.html/ref=pa_sp_atf_aps_sr_pg1_1?ie=UTF8&adId=A06013931OXQXWQTZKQ0M&url=%2FMurder-at-Venegonis-Christopher-Rutledge-ebook%2Fdp%2FB01M22NRK1%2Fref%3Dsr_1_4_sspa%3Fkeywords%3Dcrime%2Bbooks%26qid%3D1639629589%26sr%3D8-4-spons%26psc%3D1&qualifier=1639629589&id=3849533315152952&widgetName=sp_atf
"If You Tell: A True Story of Murder, Family Secrets, and the Unbreakable Bond of Sisterhood",$0.00,4.4 out of 5 stars,https://www.amazon.com/If-You-Tell-Unbreakable-Sisterhood-ebook/dp/B07Q5TL9SQ/ref=sr_1_5?keywords=crime+books&qid=1639629589&sr=8-5
Billy Summers,$15.00,4.6 out of 5 stars,https://www.amazon.com/Billy-Summers-Stephen-King/dp/1982173610/ref=sr_1_6?keywords=crime+books&qid=1639629589&sr=8-6
"The House of Gucci: A True Story of Murder, Madness, Glamour, and Greed",$0.00,4.2 out of 5 stars,https://www.amazon.com/The-House-of-Gucci/dp/B084B1PGBR/ref=sr_1_7?keywords=crime+books&qid=1639629589&sr=8-7
Mindhunter: Inside the FBI's Elite Serial Crime Unit,$10.79,4.7 out of 5 stars,https://www.amazon.com/Mindhunter-Inside-Elite-Serial-Crime/dp/1501191969/ref=sr_1_8?keywords=crime+books&qid=1639629589&sr=8-8
The Crime Book: Big Ideas Simply Explained,$15.05,4.7 out of 5 stars,https://www.amazon.com/Crime-Book-Ideas-Simply-Explained/dp/1465462864/ref=sr_1_9?keywords=crime+books&qid=1639629589&sr=8-9
Then She Was Gone: A Novel,$8.52,4.6 out of 5 stars,https://www.amazon.com/Then-She-Was-Gone-Novel/dp/1501154656/ref=sr_1_10?keywords=crime+books&qid=1639629589&sr=8-10
Murder Book: A Graphic Memoir of a True Crime Obsession,$17.99,4.3 out of 5 stars,https://www.amazon.com/Murder-Book-Graphic-Memoir-Obsession/dp/1524861162/ref=sr_1_11?keywords=crime+books&qid=1639629589&sr=8-11
"Hell in the Heartland: Murder, Meth, and the Case of Two Missing Girls",$13.58,4.6 out of 5 stars,https://www.amazon.com/Hell-Heartland-Murder-Missing-Girls/dp/1984806319/ref=sr_1_12?keywords=crime+books&qid=1639629589&sr=8-12
Mercy (Atlee Pine Book 4),$14.99,4.6 out of 5 stars,https://www.amazon.com/Mercy-Atlee-Pine-Book-4-ebook/dp/B08Y8L2WB3/ref=sr_1_13?keywords=crime+books&qid=1639629589&sr=8-13
I Am Watching You,$7.29,4.4 out of 5 stars,https://www.amazon.com/Am-Watching-You-Teresa-Driscoll/dp/1542046599/ref=sr_1_14?keywords=crime+books&qid=1639629589&sr=8-14
Spilled Milk: Based on a true story,$19.99,4.7 out of 5 stars,https://www.amazon.com/Spilled-Milk-Based-true-story/dp/0615835600/ref=sr_1_15?keywords=crime+books&qid=1639629589&sr=8-15
American Predator: The Hunt for the Most Meticulous Serial Killer of the 21st Century,$0.00,4.5 out of 5 stars,https://www.amazon.com/American-Predator-audiobook/dp/B07T85TN78/ref=sr_1_16?keywords=crime+books&qid=1639629589&sr=8-16
Brain Games - Criminal Mind Puzzles: Collect The Clues And Crack The Cases,$11.68,4.4 out of 5 stars,https://www.amazon.com/gp/slredirect/picassoRedirect.html/ref=pa_sp_mtf_aps_sr_pg1_1?ie=UTF8&adId=A01855943O67A1IN1XJZ2&url=%2FBrain-Games-Criminal-Puzzles-Collect%2Fdp%2F1640306730%2Fref%3Dsr_1_17_sspa%3Fkeywords%3Dcrime%2Bbooks%26qid%3D1639629589%26sr%3D8-17-spons%26psc%3D1&qualifier=1639629589&id=3849533315152952&widgetName=sp_mtf
"Trejo: My Life of Crime, Redemption, and Hollywood",$16.20,4.8 out of 5 stars,https://www.amazon.com/Trejo-Life-Crime-Redemption-Hollywood/dp/1982150823/ref=sr_1_18?keywords=crime+books&qid=1639629589&sr=8-18
The Case of the Murderous Dr. Cream: The Hunt for a Victorian Era Serial Killer,$17.60,4.3 out of 5 stars,https://www.amazon.com/Case-Murderous-Dr-Cream-Victorian/dp/1616206896/ref=sr_1_19?keywords=crime+books&qid=1639629589&sr=8-19
Born a Crime: Stories from a South African Childhood,$0.00,4.8 out of 5 stars,https://www.amazon.com/Born-Crime-Trevor-Noah-audiobook/dp/B01IW9TM5O/ref=sr_1_20?keywords=crime+books&qid=1639629589&sr=8-20
"True Crime Case Histories - (Books 1, 2 & 3): 32 Disturbing True Crime Stories (3 Book True Crime Collection)",$22.53,4.3 out of 5 stars,https://www.amazon.com/True-Crime-Case-Histories-Disturbing/dp/1956566090/ref=sr_1_21?keywords=crime+books&qid=1639629589&sr=8-21
City of the Dead: An Alex Delaware Novel,$14.99,,https://www.amazon.com/City-Dead-Alex-Delaware-Novel-ebook/dp/B094GS94R4/ref=sr_1_22?keywords=crime+books&qid=1639629589&sr=8-22
Killing the Mob: The Fight Against Organized Crime in America (Bill O'Reilly's Killing Series),$17.98,4.6 out of 5 stars,https://www.amazon.com/Killing-Mob-Against-Organized-OReillys/dp/125027365X/ref=sr_1_23?keywords=crime+books&qid=1639629589&sr=8-23
Tiger King: The Official Tell-All Memoir,$18.18,4.7 out of 5 stars,https://www.amazon.com/Tiger-King-Official-Tell-All-Memoir/dp/1982180420/ref=sr_1_24?keywords=crime+books&qid=1639629589&sr=8-24
Beneath Devil's Bridge: A Novel,$0.00,4.4 out of 5 stars,https://www.amazon.com/Beneath-Devils-Bridge-A-Novel/dp/B08QQ1X9VJ/ref=sr_1_25?keywords=crime+books&qid=1639629589&sr=8-25
The Perfect Wife (A Jessie Hunt Psychological Suspense Thriller—Book One),$0.00,4.4 out of 5 stars,https://www.amazon.com/Perfect-Jessie-Psychological-Suspense-Thriller-Book-ebook/dp/B07JYC69YM/ref=sr_1_26?keywords=crime+books&qid=1639629589&sr=8-26
The Sleep Experiment: An edge-of-your-seat psychological thriller (World's Scariest Legends),$7.95,4.3 out of 5 stars,https://www.amazon.com/Sleep-Experiment-edge-your-seat-psychological/dp/1988091381/ref=sr_1_27?keywords=crime+books&qid=1639629589&sr=8-27
"True Crime Activity Book for Adults: Over 100 Activities To Learn More About Infamous Serial Killers And Their Horrific Crimes - Trivia, Puzzles, Coloring Pages, Memes & More (True Crime Gifts)",$10.97,4.0 out of 5 stars,https://www.amazon.com/True-Crime-Activity-Book-Adults/dp/1801011222/ref=sr_1_28?keywords=crime+books&qid=1639629589&sr=8-28
Killers of the Flower Moon: The Osage Murders and the Birth of the FBI,$9.16,4.6 out of 5 stars,https://www.amazon.com/Killers-Flower-Moon-Osage-Murders/dp/0307742482/ref=sr_1_29?keywords=crime+books&qid=1639629589&sr=8-29
"The Curse: A Shocking True Story of Superstition, Human Sacrifice and Cannibalism (Ryan Green's True Crime)",$9.99,4.2 out of 5 stars,https://www.amazon.com/gp/slredirect/picassoRedirect.html/ref=pa_sp_mtf_aps_sr_pg1_1?ie=UTF8&adId=A039636013EVA3XQZ504A&url=%2FCurse-Shocking-Superstition-Sacrifice-Cannibalism%2Fdp%2F1674091257%2Fref%3Dsr_1_30_sspa%3Fkeywords%3Dcrime%2Bbooks%26qid%3D1639629589%26sr%3D8-30-spons%26psc%3D1&qualifier=1639629589&id=3849533315152952&widgetName=sp_mtf
The Prisoner,$13.99,4.7 out of 5 stars,https://www.amazon.com/gp/slredirect/picassoRedirect.html/ref=pa_sp_mtf_aps_sr_pg1_1?ie=UTF8&adId=A0793363WEEBJX9WMDFP&url=%2FPrisoner-Damon-Todd%2Fdp%2F1737188902%2Fref%3Dsr_1_31_sspa%3Fkeywords%3Dcrime%2Bbooks%26qid%3D1639629589%26sr%3D8-31-spons%26psc%3D1&qualifier=1639629589&id=3849533315152952&widgetName=sp_mtf
Brain Games - True Crime Puzzles,$11.68,4.5 out of 5 stars,https://www.amazon.com/gp/slredirect/picassoRedirect.html/ref=pa_sp_mtf_aps_sr_pg1_1?ie=UTF8&adId=A0207762308YXML6DEMWU&url=%2FBrain-Games-True-Crime-Puzzles%2Fdp%2F1640302727%2Fref%3Dsr_1_32_sspa%3Fkeywords%3Dcrime%2Bbooks%26qid%3D1639629589%26sr%3D8-32-spons%26psc%3D1&qualifier=1639629589&id=3849533315152952&widgetName=sp_mtf
Unspeakable Things,$11.99,4.2 out of 5 stars,https://www.amazon.com/Unspeakable-Things-Jess-Lourey/dp/1542008786/ref=sr_1_33?keywords=crime+books&qid=1639629589&sr=8-33
My Sister's Grave (Tracy Crosswhite Book 1),$0.00,4.5 out of 5 stars,https://www.amazon.com/Sisters-Grave-Tracy-Crosswhite-Book-ebook/dp/B00K2EOONI/ref=sr_1_34?keywords=crime+books&qid=1639629589&sr=8-34
The Big Book of Serial Killers (An Encyclopedia of Serial Killers),$19.95,4.7 out of 5 stars,https://www.amazon.com/Big-Book-Serial-Killers/dp/1548119644/ref=sr_1_35?keywords=crime+books&qid=1639629589&sr=8-35
The Pale-Faced Lie: A True Story,$13.75,4.5 out of 5 stars,https://www.amazon.com/Pale-Faced-Lie-True-Story/dp/0997487151/ref=sr_1_36?keywords=crime+books&qid=1639629589&sr=8-36
"Surviving Dirty John: My True Story of Love, Lies, and Murder",$12.30,4.4 out of 5 stars,https://www.amazon.com/Surviving-Dirty-John-Story-Murder/dp/1953295509/ref=sr_1_37?keywords=crime+books&qid=1639629589&sr=8-37
Murder Board (Boston Crime Thriller Book 1),$0.00,4.2 out of 5 stars,https://www.amazon.com/Murder-Board-Boston-Crime-Thriller-ebook/dp/B07W5RF6JZ/ref=sr_1_38?keywords=crime+books&qid=1639629589&sr=8-38
"Buckaroo Banzai Against the World Crime League, Et Al: A Compendium of Evils",$26.99,3.7 out of 5 stars,https://www.amazon.com/Buckaroo-Banzai-Against-World-League/dp/150672213X/ref=sr_1_39?keywords=crime+books&qid=1639629589&sr=8-39
High Achiever: The Incredible True Story of One Addict's Double Life,$12.18,4.7 out of 5 stars,https://www.amazon.com/High-Achiever-Incredible-Addicts-Double/dp/0593135938/ref=sr_1_40?keywords=crime+books&qid=1639629589&sr=8-40
High Crimes Against The Crown,$14.95,,https://www.amazon.com/Crimes-Against-Crown-Patrick-Devaney/dp/1088002781/ref=sr_1_41?keywords=crime+books&qid=1639629589&sr=8-41
"Forensics: What Bugs, Burns, Prints, DNA, and More Tell Us About Crime",$12.62,4.7 out of 5 stars,https://www.amazon.com/Forensics-Burns-Prints-About-Crime/dp/0802125158/ref=sr_1_42?keywords=crime+books&qid=1639629589&sr=8-42
The Psychopath: A True Story,$9.42,3.9 out of 5 stars,https://www.amazon.com/Psychopath-Mary-Turner-Thomson/dp/1542024994/ref=sr_1_43?keywords=crime+books&qid=1639629589&sr=8-43
"A Stranger Killed Katy: The True Story of Katherine Hawelka, Her Murder on a New York Campus, and How Her Family Fought Back",$8.99,4.5 out of 5 stars,https://www.amazon.com/Stranger-Killed-Katy-Katherine-Hawelka-ebook/dp/B08QGXZHJT/ref=sr_1_44?keywords=crime+books&qid=1639629589&sr=8-44
Golden Boy: A Murder Among the Manhattan Elite,$14.99,4.3 out of 5 stars,https://www.amazon.com/Golden-Boy-Murder-Among-Manhattan-ebook/dp/B08FZ8W12F/ref=sr_1_45?keywords=crime+books&qid=1639629589&sr=8-45
The Last Thing He Told Me: A Novel,$14.00,4.3 out of 5 stars,https://www.amazon.com/Last-Thing-He-Told-Me/dp/1501171348/ref=sr_1_46?keywords=crime+books&qid=1639629589&sr=8-46
"The Darkest Night: Two Sisters, a Brutal Murder, and the Loss of Innocence in a Small Town",$8.99,4.5 out of 5 stars,https://www.amazon.com/Darkest-Night-Sisters-Brutal-Innocence/dp/0312948468/ref=sr_1_47?keywords=crime+books&qid=1639629589&sr=8-47
The Locked Door: A gripping psychological thriller with a jaw-dropping twist,$13.99,4.4 out of 5 stars,https://www.amazon.com/Locked-Door-gripping-psychological-jaw-dropping/dp/B096M1LDQQ/ref=sr_1_48?keywords=crime+books&qid=1639629589&sr=8-48
Oscar Wilde's Wit and Wisdom: A Book of Quotations (Dover Thrift Editions),$2.99,4.5 out of 5 stars,https://www.amazon.com/Oscar-Wildes-Wit-Wisdom-Quotations/dp/0486401464/ref=sr_1_49?keywords=crime+books&qid=1639629589&sr=8-49
The Big Book of Serial Killers Volume 2: Another 150 Serial Killer Files of the World's Worst Murderers (An Encyclopedia of Serial Killers),$13.98,4.7 out of 5 stars,https://www.amazon.com/Big-Book-Serial-Killers-Encyclopedia/dp/171030779X/ref=sr_1_50?keywords=crime+books&qid=1639629589&sr=8-50
Brain Games - Criminal Mind Puzzles: Collect The Clues And Crack The Cases,$11.68,4.4 out of 5 stars,https://www.amazon.com/Brain-Games-Criminal-Puzzles-Collect/dp/1640306730/ref=sr_1_51?keywords=crime+books&qid=1639629589&sr=8-51
Unsolved Serial Killers: 10 Frightening True Crime Cases of Unidentified Serial Killers (The Ones You've Never Heard of) Volume 1,$11.11,4.3 out of 5 stars,https://www.amazon.com/Unsolved-Serial-Killers-Frightening-Unidentified/dp/B09919GZDL/ref=sr_1_52?keywords=crime+books&qid=1639629589&sr=8-52
The Evil Within: Murdered by her stepbrother – the crime that shocked a nation. The heartbreaking story of Becky Watts by her father,$11.99,4.5 out of 5 stars,https://www.amazon.com/Evil-Within-Darren-Galsworthy/dp/0008179611/ref=sr_1_53?keywords=crime+books&qid=1639629589&sr=8-53
The 57 Bus: A True Story of Two Teenagers and the Crime That Changed Their Lives (Thorndike Press Large Print Mini-collections),$19.99,4.5 out of 5 stars,https://www.amazon.com/57-Bus-Teenagers-Thorndike-Mini-collections/dp/1432849263/ref=sr_1_54?keywords=crime+books&qid=1639629589&sr=8-54
Lying Next to Me,$0.00,4.4 out of 5 stars,https://www.amazon.com/Lying-Next-Me-Gregg-Olsen-ebook/dp/B07DTB52HJ/ref=sr_1_55?keywords=crime+books&qid=1639629589&sr=8-55
"No Place for the Weak: A True Story of Deviance, Torture and Social Cleansing (Ryan Green's True Crime)",$0.00,4.1 out of 5 stars,https://www.amazon.com/No-Place-Weak-Deviance-Cleansing-ebook/dp/B092W6LRV1/ref=sr_1_56?keywords=crime+books&qid=1639629589&sr=8-56
I’m Supposed to Make a Difference: A Memoir About Overcoming Trauma and Abuse,$0.00,3.7 out of 5 stars,https://www.amazon.com/gp/slredirect/picassoRedirect.html/ref=pa_sp_btf_aps_sr_pg1_1?ie=UTF8&adId=A04180423RRJBVEDOHYMC&url=%2FIm-Supposed-Make-Difference-Overcoming-ebook%2Fdp%2FB09C3Z7XC5%2Fref%3Dsr_1_57_sspa%3Fkeywords%3Dcrime%2Bbooks%26qid%3D1639629589%26sr%3D8-57-spons%26psc%3D1&qualifier=1639629589&id=3849533315152952&widgetName=sp_btf
The Assassination of Fred Hampton: How the FBI and the Chicago Police Murdered a Black Panther,$10.99,4.9 out of 5 stars,https://www.amazon.com/gp/slredirect/picassoRedirect.html/ref=pa_sp_btf_aps_sr_pg1_1?ie=UTF8&adId=A0937885V96M48GX95K0&url=%2FAssassination-Fred-Hampton-Chicago-Murdered-ebook%2Fdp%2FB07XSGL8YX%2Fref%3Dsr_1_58_sspa%3Fkeywords%3Dcrime%2Bbooks%26qid%3D1639629589%26sr%3D8-58-spons%26psc%3D1&qualifier=1639629589&id=3849533315152952&widgetName=sp_btf
A Touch of Torment (A Nick Bracco Thriller Book 7),$0.00,4.5 out of 5 stars,https://www.amazon.com/gp/slredirect/picassoRedirect.html/ref=pa_sp_btf_aps_sr_pg1_1?ie=UTF8&adId=A0804719VSZ5M7QGLPA0&url=%2FTouch-Torment-Nick-Bracco-Thriller-ebook%2Fdp%2FB08H5VVW6Q%2Fref%3Dsr_1_59_sspa%3Fkeywords%3Dcrime%2Bbooks%26qid%3D1639629589%26sr%3D8-59-spons%26psc%3D1&qualifier=1639629589&id=3849533315152952&widgetName=sp_btf
The End of Recidivism: The Ultimate Guide to Transforming the Mind of the Incarcerated,$9.99,4.9 out of 5 stars,https://www.amazon.com/gp/slredirect/picassoRedirect.html/ref=pa_sp_btf_aps_sr_pg1_1?ie=UTF8&adId=A02111751CE15SF8MBFZR&url=%2FEnd-Recidivism-Ultimate-Transforming-Incarcerated-ebook%2Fdp%2FB093CT82NX%2Fref%3Dsr_1_60_sspa%3Fkeywords%3Dcrime%2Bbooks%26qid%3D1639629589%26sr%3D8-60-spons%26psc%3D1&qualifier=1639629589&id=3849533315152952&widgetName=sp_btf
Why She Lied: A Riveting Psychological Thriller Based on A True Story,$11.74,4.0 out of 5 stars,https://www.amazon.com/gp/slredirect/picassoRedirect.html/ref=pa_sp_atf_next_aps_sr_pg2_1?ie=UTF8&adId=A03983961GLRXZ5TYK69R&url=%2FWhy-She-Lied-Riveting-Psychological%2Fdp%2F1797907492%2Fref%3Dsr_1_49_sspa%3Fkeywords%3Dcrime%2Bbooks%26qid%3D1639629591%26sr%3D8-49-spons%26psc%3D1&qualifier=1639629591&id=7610010392027085&widgetName=sp_atf_next
"The FBI Story: Leadership, Integrity, Agility, Integration",$14.99,4.6 out of 5 stars,https://www.amazon.com/gp/slredirect/picassoRedirect.html/ref=pa_sp_atf_next_aps_sr_pg2_1?ie=UTF8&adId=A02658743O3Q445FLRWSL&url=%2FFBI-Story-Leadership-Integrity-Integration%2Fdp%2F1510750525%2Fref%3Dsr_1_50_sspa%3Fkeywords%3Dcrime%2Bbooks%26qid%3D1639629591%26sr%3D8-50-spons%26psc%3D1&qualifier=1639629591&id=7610010392027085&widgetName=sp_atf_next
The Ultimate New York Yankees Trivia Book: A Collection of Amazing Trivia Quizzes and Fun Facts for Die-Hard Yankees Fans!,$9.85,4.8 out of 5 stars,https://www.amazon.com/gp/slredirect/picassoRedirect.html/ref=pa_sp_atf_next_aps_sr_pg2_1?ie=UTF8&adId=A0536612NKCSBI83Z3PH&url=%2FUltimate-York-Yankees-Trivia-Book%2Fdp%2F1953563023%2Fref%3Dsr_1_51_sspa%3Fkeywords%3Dcrime%2Bbooks%26qid%3D1639629591%26sr%3D8-51-spons%26psc%3D1&qualifier=1639629591&id=7610010392027085&widgetName=sp_atf_next
I’m Supposed to Make a Difference: A Memoir About Overcoming Trauma and Abuse,$10.99,3.7 out of 5 stars,https://www.amazon.com/gp/slredirect/picassoRedirect.html/ref=pa_sp_atf_next_aps_sr_pg2_1?ie=UTF8&adId=A041788637Z78B4RSU2NF&url=%2FIm-Supposed-Make-Difference-Overcoming%2Fdp%2F1736523872%2Fref%3Dsr_1_52_sspa%3Fkeywords%3Dcrime%2Bbooks%26qid%3D1639629591%26sr%3D8-52-spons%26psc%3D1&qualifier=1639629591&id=7610010392027085&widgetName=sp_atf_next
Secrets in the Cellar: A True Story of the Austrian Incest Case that Shocked the World,$7.99,4.4 out of 5 stars,https://www.amazon.com/Secrets-Cellar-Austrian-Incest-Shocked/dp/0312947860/ref=sr_1_53?keywords=crime+books&qid=1639629591&sr=8-53
"The Girl They Took: A completely gripping, heart-stopping kidnapping thriller (Tess Winnett)",$0.00,4.4 out of 5 stars,https://www.amazon.com/Girl-They-Took-completely-heart-stopping-ebook/dp/B08ZS57PS1/ref=sr_1_54?keywords=crime+books&qid=1639629591&sr=8-54
In Cold Blood,$10.29,4.6 out of 5 stars,https://www.amazon.com/Cold-Blood-Truman-Capote/dp/0679745580/ref=sr_1_55?keywords=crime+books&qid=1639629591&sr=8-55
"A Tangled Web: A Cyberstalker, a Deadly Obsession, and the Twisting Path to Justice.",$14.49,4.5 out of 5 stars,https://www.amazon.com/Tangled-Web-Cyberstalker-Obsession-Twisting/dp/0806539984/ref=sr_1_56?keywords=crime+books&qid=1639629591&sr=8-56
"Taken at Birth: Stolen Babies, Hidden Lies, and My Journey to Finding Home",$15.66,4.4 out of 5 stars,https://www.amazon.com/Taken-Birth-Stolen-Journey-Finding/dp/0800739418/ref=sr_1_57?keywords=crime+books&qid=1639629591&sr=8-57
Freaking Idiots Guide To Selling On eBay: How anyone can make $100 or more everyday selling on eBay (Freaking Idiots Guides),$15.99,4.0 out of 5 stars,https://www.amazon.com/Freaking-Idiots-Guide-Selling-eBay/dp/1482647729/ref=sr_1_58?keywords=crime+books&qid=1639629591&sr=8-58
Spoken Bones (A DI Fenella Sallow Crime Thriller Book 1),$0.00,4.3 out of 5 stars,https://www.amazon.com/Spoken-Bones-Fenella-Sallow-Thriller-ebook/dp/B09JM75CCQ/ref=sr_1_59?keywords=crime+books&qid=1639629591&sr=8-59
"Come Hell or High Water: A Scottish Murder Mystery: DCI Logan Crime Thrillers, Book 13",$0.00,5.0 out of 5 stars,https://www.amazon.com/Come-Hell-High-Water-Thrillers/dp/B09NF2Q748/ref=sr_1_60?keywords=crime+books&qid=1639629591&sr=8-60
Troubled Blood (A Cormoran Strike Novel Book 5),$12.99,4.6 out of 5 stars,https://www.amazon.com/Troubled-Blood-Cormoran-Strike-Novel-ebook/dp/B084X5WVX9/ref=sr_1_61?keywords=crime+books&qid=1639629591&sr=8-61
"Ink and Shadows: A Witty & Page-Turning Southern Cozy Mystery (A Secret, Book, and Scone Society Novel Book 4)",$1.99,4.6 out of 5 stars,https://www.amazon.com/Shadows-Secret-Scone-Society-Novel-ebook/dp/B087YR9M54/ref=sr_1_62?keywords=crime+books&qid=1639629591&sr=8-62
Crime and Punishment,$10.49,4.4 out of 5 stars,https://www.amazon.com/Crime-Punishment-Fyodor-Dostoyevsky/dp/1703766172/ref=sr_1_63?keywords=crime+books&qid=1639629591&sr=8-63
Never Look Back,$0.00,4.4 out of 5 stars,https://www.amazon.com/Never-Look-Back-Mary-Burton-ebook/dp/B07XJTDDC5/ref=sr_1_64?keywords=crime+books&qid=1639629591&sr=8-64
Brain Games - Crime Scene Investigation (CSI) Puzzles #2 (Volume 2),$12.98,4.4 out of 5 stars,https://www.amazon.com/gp/slredirect/picassoRedirect.html/ref=pa_sp_mtf_aps_sr_pg2_1?ie=UTF8&adId=A0185038OR6NPT2M97F7&url=%2FBrain-Games-Crime-Scene-Investigation%2Fdp%2F1640305890%2Fref%3Dsr_1_65_sspa%3Fkeywords%3Dcrime%2Bbooks%26qid%3D1639629591%26sr%3D8-65-spons%26psc%3D1&qualifier=1639629591&id=7610010392027085&widgetName=sp_mtf
Brain Games Large Print - Crime Scene Puzzles,$12.98,4.3 out of 5 stars,https://www.amazon.com/Brain-Games-Large-Print-Puzzles/dp/1640308369/ref=sr_1_66?keywords=crime+books&qid=1639629591&sr=8-66
The Guardians: A Novel,$0.00,4.5 out of 5 stars,https://www.amazon.com/The-Guardians-John-Grisham-audiobook/dp/B07R8W9QZ5/ref=sr_1_67?keywords=crime+books&qid=1639629591&sr=8-67
The Dancing Girls: An absolutely gripping crime thriller with nail-biting suspense (Detective Jo Fournier Book 1),$2.99,4.2 out of 5 stars,https://www.amazon.com/Dancing-Girls-absolutely-nail-biting-Detective-ebook/dp/B07NRG8PFH/ref=sr_1_68?keywords=crime+books&qid=1639629591&sr=8-68
Crimes Glass Vanity: A Takeover from Within,$31.95,5.0 out of 5 stars,https://www.amazon.com/Crimes-Glass-Vanity-Takeover-Within/dp/1638818851/ref=sr_1_69?keywords=crime+books&qid=1639629591&sr=8-69
If She Knew (A Kate Wise Mystery—Book 1),$0.00,4.4 out of 5 stars,https://www.amazon.com/She-Knew-Kate-Wise-Mystery-Book-ebook/dp/B07GX3BR7P/ref=sr_1_70?keywords=crime+books&qid=1639629591&sr=8-70
To Kill and Kill Again: The Terrifying True Story of Montana's Baby-Faced Serial Sex Murderer,$19.84,4.4 out of 5 stars,https://www.amazon.com/Kill-Again-Terrifying-Montanas-Baby-Faced/dp/1504049403/ref=sr_1_71?keywords=crime+books&qid=1639629591&sr=8-71
The Last Sister (Columbia River Book 1),$0.00,4.4 out of 5 stars,https://www.amazon.com/Last-Sister-Kendra-Elliot-ebook/dp/B07SLZ9LMN/ref=sr_1_72?keywords=crime+books&qid=1639629591&sr=8-72
"The Girls Are Gone: The True Story of Two Sisters Who Vanished, the Father Who Kept Searching, and the Adults Who Conspired to Keep the Truth Hidden",$0.99,4.1 out of 5 stars,https://www.amazon.com/Girls-Are-Gone-Searching-Conspired-ebook/dp/B07JKJCWGY/ref=sr_1_73?keywords=crime+books&qid=1639629591&sr=8-73
The Family Next Door: The Heartbreaking Imprisonment of the Thirteen Turpin Siblings and Their Extraordinary Rescue,$7.99,4.5 out of 5 stars,https://www.amazon.com/Family-Next-Door-Heartbreaking-Extraordinary-ebook/dp/B07J4VC6LX/ref=sr_1_74?keywords=crime+books&qid=1639629591&sr=8-74
The New York Times Book of Crime: More Than 166 Years of Covering the Beat,$23.49,4.5 out of 5 stars,https://www.amazon.com/New-York-Times-Book-Crime/dp/1402793235/ref=sr_1_75?keywords=crime+books&qid=1639629591&sr=8-75
3rd Degree (Women's Murder Club),$7.99,4.7 out of 5 stars,https://www.amazon.com/3rd-Degree-Womens-Murder-Club-ebook/dp/B000FC1APM/ref=sr_1_76?keywords=crime+books&qid=1639629591&sr=8-76
A Billion Decisions: A Dark Billionaire Mafia Romance (The Rosetti Crime Family Book 6),$2.99,5.0 out of 5 stars,https://www.amazon.com/dp/B09NN1KYFL/ref=sr_1_77?keywords=crime+books&qid=1639629591&sr=8-77
Flipping the Circle: A Political Thriller,$19.95,4.0 out of 5 stars,https://www.amazon.com/gp/slredirect/picassoRedirect.html/ref=pa_sp_mtf_aps_sr_pg2_1?ie=UTF8&adId=A02613601BUX1W5X2JVQT&url=%2FFlipping-Circle-Political-Michael-Leppert%2Fdp%2F1632994372%2Fref%3Dsr_1_78_sspa%3Fkeywords%3Dcrime%2Bbooks%26qid%3D1639629591%26sr%3D8-78-spons%26psc%3D1&qualifier=1639629591&id=7610010392027085&widgetName=sp_mtf
Brain Games Large Print - Crime Scene Puzzles,$12.98,4.3 out of 5 stars,https://www.amazon.com/gp/slredirect/picassoRedirect.html/ref=pa_sp_mtf_aps_sr_pg2_1?ie=UTF8&adId=A075841817NTTBD3DZXRA&url=%2FBrain-Games-Large-Print-Puzzles%2Fdp%2F1640308369%2Fref%3Dsr_1_79_sspa%3Fkeywords%3Dcrime%2Bbooks%26qid%3D1639629591%26sr%3D8-79-spons%26psc%3D1&qualifier=1639629591&id=7610010392027085&widgetName=sp_mtf
After Dunkirk (The After Dunkirk Series Book 1),$0.00,4.4 out of 5 stars,https://www.amazon.com/gp/slredirect/picassoRedirect.html/ref=pa_sp_mtf_aps_sr_pg2_1?ie=UTF8&adId=A069699822QEABOGBCAYC&url=%2FAfter-Dunkirk-Book-ebook%2Fdp%2FB08FPD4S8N%2Fref%3Dsr_1_80_sspa%3Fkeywords%3Dcrime%2Bbooks%26qid%3D1639629591%26sr%3D8-80-spons%26psc%3D1&qualifier=1639629591&id=7610010392027085&widgetName=sp_mtf
Brain Games - True Crime Puzzles,$11.68,4.5 out of 5 stars,https://www.amazon.com/Brain-Games-True-Crime-Puzzles/dp/1640302727/ref=sr_1_81?keywords=crime+books&qid=1639629591&sr=8-81
One Little Lie: A Thrilling Suspense Novel,$15.99,4.3 out of 5 stars,https://www.amazon.com/One-Little-Lie-Thrilling-Suspense/dp/1683993365/ref=sr_1_82?keywords=crime+books&qid=1639629591&sr=8-82
The Best New True Crime Stories: Serial Killers: (True crime gift),$14.39,4.4 out of 5 stars,https://www.amazon.com/Best-New-True-Crime-Stories/dp/1642500720/ref=sr_1_83?keywords=crime+books&qid=1639629591&sr=8-83
Stephen King Hard Case Crime Box Set (The Hard Case Crime Novels of Stephen King),$29.49,4.7 out of 5 stars,https://www.amazon.com/Stephen-King-Hard-Case-Crime/dp/1789097568/ref=sr_1_84?keywords=crime+books&qid=1639629591&sr=8-84
The Double-A Western Detective Agency: A Holmes on the Range Mystery (Holmes on the Range Mysteries),$13.95,4.7 out of 5 stars,https://www.amazon.com/Double-Western-Detective-Agency-Mysteries/dp/1790516161/ref=sr_1_85?keywords=crime+books&qid=1639629591&sr=8-85
